{
  "task_id": "T030",
  "issue_commit": "82dd11fcacba9ad3e041379969825f122d1e8961",
  "classification": "CONTRACT_MISMATCH",
  "summary": "T030 contract body is expressed in two layers: a frozen-from-baseline body marked `Contract status: FROZEN_FROM_BASELINE_6C31778` plus a 2026-09-16 Owner amendment block at the top of todo/phases/P03-ingestion-and-storage/T030.md. Per Owner decision #5 (/tmp/owner_decision_T030.txt) the amendment is binding direction and must be merged into the contract Outcome / Deliverables / Acceptance / Must-not / References sections by the planning route; Developer is forbidden from picking only the frozen body or only the amendment. attempt 001 reached TRIAGE_REQUIRED before the contract was merged, with partial schema/test edits retained on branch workflow/t030-attempt-001 as diagnostic evidence.",
  "evidence": [
    "todo/phases/P03-ingestion-and-storage/T030.md expresses the contract in two layers: `> Contract status: FROZEN_FROM_BASELINE_6C31778` and `> Owner amendment (2026-09-16): ADR-010 fixes the A+B free ingestion path and the minimum provenance/normalized field set below.`",
    "/tmp/owner_decision_T030.txt Decision 5: amendment is binding; Planner must merge into a single unified contract body; Developer must not pick only one layer; if no plan review is recorded, route through triage -> planning -> plan-review.",
    "/tmp/owner_decision_T030.txt Decisions 1 and 2 require Implementation status wording to label src/robinhood_lp/storage/schema.py + related tests as pre-existing unverified implementation (WORKFLOW.md migration rule), and to delineate T030 (logical schema) vs T031 (Parquet column/partition/manifest layout).",
    "docs/spec/architecture/adr/ADR-010-free-dual-provider-ingestion.md and docs/spec/architecture/adr/ADR-002-storage-and-query-format.md are accepted and consistent; the gap is that T030.md does not yet incorporate ADR-010's normalized field set, normalized content hash, and provenance/content identity separation into its unified contract body.",
    "todo/evidence/P03/T030/attempt-001-developer.json reports `outcome: TRIAGE_REQUIRED` because the Developer could not execute against the dual-layer contract; todo/config.yaml reflects workflow_state=TRIAGE_REQUIRED at base_commit 54b1edc.",
    "Diff between base_commit (54b1edc) and issue_commit (82dd11f) shows T030.md is unchanged — implementation files, todo/config.yaml, and v4-core ABI artifact changed, but the contract itself was not merged by the Developer. Per WORKFLOW.md, contract/Spec consolidation belongs to the planning lane, not the Developer lane."
  ],
  "recommended_action": "Route to planning (Planner -> independent Plan Reviewer) for T030. Planner merges the 2026-09-16 Owner amendment into a single unified contract body by updating Outcome / Deliverables / Acceptance / Must-not / References sections, removes the separate `FROZEN_FROM_BASELINE_6C31778` marker + top amendment block, adds Implementation status wording that src/robinhood_lp/storage/schema.py + related tests are pre-existing unverified implementation, clarifies T030 = logical schema and T031 = Parquet column/partition/manifest layout, and explicitly adds Acceptance for normalized content hash equality across providers and provenance/content identity separation. Do not bypass planning by editing the contract from the Developer lane. Retain the workflow/t030-attempt-001 branch (and src/robinhood_lp/storage/* + tests/test_storage_schema.py + v4-core ABI artifact + SelectorOracle changes) as a diagnostic snapshot per WORKFLOW.md 'If triage is raised after partial implementation work'. Independent Plan Reviewer must confirm completeness, consistency, and that acceptance was not weakened before the next Developer attempt.",
  "owner_question": null
}
