{
  "task_id": "T031",
  "issue_commit": "6051869416787fb707ee9e9239f3d9bdb90f03fa",
  "classification": "CONTRACT_MISMATCH",
  "summary": "T031 contract body is expressed in two layers: a frozen-from-baseline body marked `Contract status: FROZEN_FROM_BASELINE_6C31778` plus a 2026-09-16 Owner amendment block at the top of todo/phases/P03-ingestion-and-storage/T031.md. Per Owner decision #5 (/tmp/owner_decision_T031.txt) the amendment is binding direction and must be merged into the contract Outcome / Deliverables / Acceptance / Must-not / References sections by the planning route; Developer is forbidden from picking only the frozen body or only the amendment. attempt 001 reached TRIAGE_REQUIRED before the contract was merged. The T031 amendment is narrower in body than the parallel T030 amendment (which has already been consolidated by Planner into a merged contract in commit 9a44378 / approved at 870c07d per todo/config.yaml T030 status APPROVED), but T031 still carries the same dual-layer expression and must go through the same planning route.",
  "evidence": [
    "todo/phases/P03-ingestion-and-storage/T031.md expresses the contract in two layers: `> Contract status: FROZEN_FROM_BASELINE_6C31778` and `> Owner amendment (2026-09-16): storage evidence must support ADR-010 provider provenance and measured call/data-volume reporting.` (lines 4 and 6-7).",
    "git show a07c6a8 -- 'todo/phases/P03-ingestion-and-storage/T031.md' confirms the Owner amendment was appended to the frozen body on 2026-09-16 as part of 'docs: define free dual-provider P03 ingestion', and the file is otherwise unmodified between baseline 6c31778 and the issue commit 6051869.",
    "/tmp/owner_decision_T031.txt Decision 5: amendment is binding; Planner must merge into a single unified contract body; Developer must not pick only one layer; if no plan review is recorded, route through triage -> planning -> plan-review. Decision 2 (T031 specific) requires the merged contract to make explicit: append-only raw partitions (ADR-002) + Parquet column layout; acquisition envelope/manifest fields (endpoint alias, retrieval time, request interval, HTTP batch metadata); normalized event identity/content hash excluding observational fields; two raw acquisition envelopes retained and checksummed; manifest accounting split by endpoint alias, logical RPC calls, HTTP requests/batches, response bytes, normalized rows, provider units, Parquet bytes, scanned-empty intervals; dedup by T011 EventKey + normalized content (not by ingestion time / endpoint / block number / filename); conflicting observations retained and halt qualification. Decision 2 also states ADR-002 is not reopened; only re-evaluate when implementation proves two-layer structure cannot satisfy requirements.",
    "docs/spec/architecture/adr/ADR-010-free-dual-provider-ingestion.md and docs/spec/architecture/adr/ADR-002-storage-and-query-format.md are accepted and internally consistent; the gap is that T031.md has not yet incorporated ADR-010's normalized field set, normalized content hash equality, provenance/content identity separation, manifest-accounting split, dedup framing rule, and conflicting-observation policy into its unified contract body.",
    "todo/evidence/P03/T031/attempt-001-developer.json reports `outcome: TRIAGE_REQUIRED` and explains the Developer could not execute against the dual-layer contract; todo/config.yaml reflects workflow_state=TRIAGE_REQUIRED with T031 attempt=1, base_commit=cd56704, and no candidate_commit. No implementation code was touched in this attempt (git status clean other than the triage_required commit itself).",
    "The sibling task T030 was triaged as CONTRACT_MISMATCH with the identical dual-layer pattern (todo/triage/P03/T030/triage-001.json) and routed to planning. The Planner produced a merged T030 contract body in 9a44378 'docs(t030): planning candidate', the plan was reviewed (d66c935), and T030 is now APPROVED (approved_commit=870c07d). T031 must follow the same planning route, not bypass it with a Developer-lane contract edit.",
    "Diff between T031 base_commit (cd56704) and issue_commit (6051869) is limited to todo/config.yaml (status flip, attempt, base_commit) and todo/evidence/P03/T031/attempt-001-developer.json (TRIAGE_REQUIRED outcome). No contract merge was attempted by the Developer, which is correct per WORKFLOW.md: contract/Spec consolidation belongs to the planning lane."
  ],
  "recommended_action": "Route T031 to the planning lane (Planner -> independent Plan Reviewer), paralleling the T030 path. Planner must merge the 2026-09-16 Owner amendment into a single unified T031 contract body by updating the Outcome / Deliverables / Acceptance / Must-not / References sections of todo/phases/P03-ingestion-and-storage/T031.md, remove the separate `FROZEN_FROM_BASELINE_6C31778` marker plus the top amendment block, and inline Owner Decision 2 verbatim where it changes contract text: (a) T030 = logical schema, T031 = Parquet column/partition/manifest physical layout following ADR-002; (b) append-only raw partitions (ADR-002) with the Parquet column layout carrying the raw envelope/manifest fields (endpoint alias, retrieval time, request interval, HTTP batch metadata) separately from the normalized event identity and content hash; (c) the canonical normalized content hash excludes observational fields so the same chain event fetched from A and B compares equal, while both raw acquisition envelopes are retained and checksummed; (d) manifest accounting split by endpoint alias, logical RPC calls, HTTP requests/batches, response bytes, normalized rows, provider units when reported, Parquet bytes, and explicit scanned-empty intervals; (e) dedup by T011 EventKey + normalized content (not by ingestion time, endpoint, block number alone, or filename); conflicting observations are retained and halt qualification instead of silently overwriting; (f) acceptance requires at least one representative short-range measurement that justifies partition sizing without turning the observed volume into a universal constant. Keep the existing T031 Must-not clauses (no mutate/delete of orphaned raw evidence, no half-written partitions, no filenames as manifests). Add an Implementation status note for any pre-existing unverified implementation in src/robinhood_lp/storage/* analogous to the T030 wording, and reference R13, ADR-002, ADR-010, ADR-011. The merged contract must also preserve an audit trail referencing /tmp/owner_decision_T031.txt as the binding source. Do not bypass planning by editing the contract from the Developer lane. Independent Plan Reviewer must confirm completeness, consistency, and that acceptance was not weakened before the next Developer attempt; plan review only approves contract executability, not implementation, and does not change T031 implementation status. Then re-enter the standard prepare/Developer/Reviewer cycle from the merged contract.",
  "owner_question": null
}
