{
  "task_id": "T011",
  "issue_commit": "0007b3e2cd3dd43b38df98dc21f5aeb52e542e6b",
  "classification": "SPEC_DEFECT",
  "summary": "Owner's five decisions (1A 2A 3A 4A 5A) force amendments to T011/T012/T013 contracts and a new ADR-009. No code was attempted; the developer role is not the place to amend frozen contracts. Route to PLANNING per tools/workflow/core.py:1054-1055.",
  "evidence": [
    "todo/phases/P01-protocol-foundation/T011.md:1-37 - FROZEN_FROM_BASELINE_6C31778 contract. T011 Deliverables (lines 20-21) name token/native metadata, BlockRef, TransactionRef, EventKey, canonical/orphaned/removed status, and deterministic serialization. T011 Acceptance (lines 24-27) requires chain ID, block hash/number, tx hash and log index, cross-chain/fork collision tests, and representability of absent/nonstandard token metadata. T011 Must-not (lines 30-32) forbids requiring symbol/name, using (tx_hash, log_index) without chain, or discarding an orphaned identity. No mention of PoolIdentity, no chain-46630 placeholder, no PoolManager address requirement.",
    "todo/phases/P01-protocol-foundation/T012.md:1-39 - FROZEN_FROM_BASELINE_6C31778 contract. T012 Deliverables (lines 22-23) list tick/sqrtPriceX96, raw amount, display price, liquidity, bounded position amount, and usable-tick functions. T012 Acceptance (lines 26-28) requires golden/property tests over MIN/MAX tick, both swap directions, exact-in/out rounding, 0/6/8/18/24 decimals, overflow/revert domains, monotonicity, and round trips against a pinned Solidity harness. T012 Must-not (lines 31-34) forbids translating through float, broadening Solidity integer domains, or using a tolerance where canonical integer equality is possible. 'Display price' is currently inside the protocol-package Deliverables; the float API in math.py:402-421 is still present, and MathOracle.sol:28-42 hard-codes roundUp=false.",
    "todo/phases/P01-protocol-foundation/T013.md:1-38 - FROZEN_FROM_BASELINE_6C31778 contract. T013 Deliverables (lines 22-23) list a pinned Foundry/TypeScript vector generator, immutable JSON vectors, a provenance manifest with repository commits/tool versions/checksums, and a drift test. T013 Acceptance (lines 26-28) requires reproducible clean runs, drift detection, and at least one manually reviewed vector per edge class. T013 Must-not (lines 31-34) forbids importing Python production math into the oracle and forbids fetching mutable main during tests. No per-edge-class 'reviews' block; no byte-comparison regeneration requirement; no prohibition on agent self-attestation.",
    "src/robinhood_lp/protocol/math.py:402-421 - Float API still present: `def sqrt_price_x96_to_price(sqrt_price_x96: int) -> float` and `def price_to_sqrt_price_x96(price: float) -> int`. Documented in-module as 'Display helpers (boundary only; ADR-004)'. This is the file Owner direction 1A says must be removed entirely (no rename-and-retype alternative).",
    "src/robinhood_lp/protocol/__init__.py:54-55,93-94 - Protocol package re-exports price_to_sqrt_price_x96 and sqrt_price_x96_to_price from math. Removal of the float API per Owner 1A requires this re-export to drop as well.",
    "src/robinhood_lp/protocol/math.py:308-342 - get_amount0_delta and get_amount1_delta are hard-coded to round-down via floor division. Owner 2A forces a `round_up: bool` parameter and a second Foundry vector per function.",
    "tools/oracle/src/MathOracle.sol:28-42 - amount0Delta and amount1Delta wrappers call SqrtPriceMath.getAmount0Delta(..., false) and SqrtPriceMath.getAmount1Delta(..., false) with the false hard-coded. Owner 2A forces a bool roundUp parameter on the wrappers so the Foundry test can pin both directions.",
    "tests/test_oracle_provenance.py:10-14 - Module docstring states 'This test does NOT shell out to Foundry (the sandbox is offline); it only verifies that the documented provenance matches what is committed alongside the test'. Owner 5A requires a test that DOES shell out to `forge test --json`.",
    "tests/test_oracle_provenance.py:106-142 - test_python_fixtures_match_oracle_outputs_by_construction is a file-existence and edge-class-presence check; the docstring at lines 107-111 explicitly says the byte-exact equality is delegated to test_protocol_ids.py / test_protocol_math.py. Owner 5A requires byte-comparison against committed JSON as the primary drift gate.",
    "docs/implement/evidence/ORACLE_MANIFEST.md:53-67 - 'Reproducing the manifest' block instructs the operator to compare pinned commits against current upstream and to either update the manifest or pin a different commit. This is a mutable-main reconciliation recipe; Owner 5A requires a test that fails closed on drift, not a recipe for hand-resolving it.",
    "docs/spec/architecture/adr/ - Directory listing contains ADR-001-web3-client-and-concurrency.md, ADR-002-storage-and-query-format.md, ADR-003-configuration-and-secrets.md, ADR-004-integer-decimal-precision.md, ADR-005-supported-chain-policy.md, ADR-006-dependency-direction.md, ADR-007-ci-provider.md, ADR-008-document-precedence.md. ADR-009 does not exist. Owner 1A says 'A new ADR-009 must be drafted under docs/spec/architecture/adr/'.",
    "src/robinhood_lp/protocol/ids.py:248-289 - Defines the on-chain V4 `PoolId` as a 32-byte keccak256 of the ABI-encoded PoolKey. Owner 3A forbids replacing this with `PoolIdentity`; `PoolIdentity` must be a new composite record in our own data model.",
    "src/robinhood_lp/protocol/ - Directory listing: abi_artifacts.py, abi.py, events.py, ids.py, math.py, run_mode.py. No PoolIdentity module is present; the developer role is not the right place to add one (that is a spec decision).",
    "docs/spec/architecture/ARCHITECTURE.md:164-174 - ADR catalogue table lists ADR-001 through ADR-008. ADR-009 row is absent; Owner 1A forces a new row referencing the display-decimal-boundary ADR.",
    "docs/spec/architecture/adr/ADR-004-integer-decimal-precision.md - existing ADR-004 already names the two-domain policy (integer mandatory in protocol/replay/features/valuation/accounting; Decimal at a named display boundary). Owner 1A points the new ADR-009 at the display-boundary side and forbids the float API; ADR-009 is the natural place to capture that explicit decision.",
    "tools/workflow/core.py:1052-1058 - state transition table: SPEC_DEFECT -> PLANNING. Routing this triage result as SPEC_DEFECT therefore sends T011 back to PLANNING, where the planner's scope per core.py:1185-1187 includes todo/phases/ and docs/spec/ (and todo/config.yaml).",
    "tools/workflow/core.py:1185-1187 - planner scope guard for SPEC_DEFECT: allowed paths are todo/phases/, todo/config.yaml, and docs/spec/. The planner will touch only these (plus the ADR catalogue row in docs/spec/architecture/ARCHITECTURE.md section 4); src/, tests/, tools/oracle/, tools/workflow/, and docs/implement/ are out of scope for the planner, and the existing pre-existing unverified implementation is preserved untouched.",
    "tools/workflow/core.py:953-957 - A SPEC_DEFECT developer result transitions the task back to PLANNING per the state machine at lines 1053-1057. The planner is the role that amends contracts; the developer role is forbidden from editing todo/phases/, docs/spec/, docs/intent/, or any contract file per the protected-files policy.",
    "Owner 1A/2A/3A/4A/5A are recorded verbatim in the current Manager conversation as the Owner's follow-up answers; they are not paraphrased here. The Owner's first message named ADR-004 as the display-decimal reference, which makes ADR-009 the natural place to capture the new display-boundary decision.",
    "WORKFLOW.md 'Pre-existing unverified implementation' clause - the existing code under src/, tests/, tools/oracle/, and docs/implement/ is pre-existing unverified; the planner's amendments do not delete code, only rewrite the frozen contracts and draft ADR-009. After the planner amends the contracts, T011 / T012 / T013 are re-queued through the normal Developer -> Reviewer route.",
    "Issue commit 0007b3e2cd3dd43b38df98dc21f5aeb52e542e6b ('chore(workflow): record T011 triage_required') records the developer handoff in todo/evidence/P01/T011/attempt-001-developer.json with outcome=TRIAGE_REQUIRED and triage_request.proposed_classification=SPEC_DEFECT. The current triage worktree is at HEAD detached at this commit."
  ],
  "owner_question": null,
  "recommended_action": "Issue Triager recommends the planning path: SPEC_DEFECT routes to PLANNING. The next step is to invoke the planner sub-agent in the controller-created planning worktree. The planner must (a) amend `todo/phases/P01-protocol-foundation/{T011,T012,T013}.md` per the Owner's five directions and five answers (1A 2A 3A 4A 5A), (b) draft a new `docs/spec/architecture/adr/ADR-009-display-decimal-boundary.md` capturing the display-boundary decision, (c) add one row to the ADR catalogue in `docs/spec/architecture/ARCHITECTURE.md` §4 referencing ADR-009, and (d) touch nothing outside SPEC_DEFECT planner scope (no src/, tests/, tools/oracle/, tools/workflow/, requirements.lock.txt, pyproject.toml, AGENTS.md, CLAUDE.md, todo/README.md, todo/schemas/, todo/config.yaml, .claude/). The planner must NOT push, merge, or call any controller command other than those provided by the Manager. The planner must NOT modify task state. After plan-review passes, Developer attempt 2 of T011 will implement the contract changes for T011 (the PoolIdentity composite). T012 and T013 will follow Developer attempt 1 paths once their amended contracts are read from main."
}
